{"schemaVersion":1,"verdict":"FAIL","summary":"R9 fails: after an ordering-only finalization migration, retained dependency edges and module numbers can contradict the displayed stage groups. The other nine criteria pass. Scope passes; gap and contradiction checks fail.","criteria":[{"id":"R1","title":"AC1: Policy and graph compatibility","result":"PASS","explanation":"Schema-1 policy validation, default generation and hashing remain supported. Schema-2 ordering is canonicalized and retained separately from unchanged module definitions. Historical graph validation remains supported.","evidence":["plugin-src/shared/resources/protocol/modules.js:115-158, 509-550, 672-687","plugin-src/shared/resources/protocol/model.js:348-353","cli/test/owner-ordering.test.js:20 — compatibility/hash/round-trip test independently passed."]},{"id":"R2","title":"AC2: Validation","result":"PASS","explanation":"Resolution rejects malformed ordering, unknown or unselected endpoints, self-links, repeated links, duplicate manifest relationships, cross-slot edges and active combined cycles. Invalid candidates cannot publish policy or migrate the feature.","evidence":["plugin-src/shared/resources/protocol/modules.js:134-144, 553-578, 644-669","apps/desktop/main/module-policy.js:227-240, 324-338","cli/test/owner-ordering.test.js:34 — negative validation test independently passed."]},{"id":"R3","title":"AC2: Conditional and protected behavior","result":"PASS","explanation":"Owner relationships remain stored while disabled and constrain the graph only when both endpoints are enabled. Re-enablement restores them. Locked modules and enabled modules' hard prerequisites remain enforced.","evidence":["plugin-src/shared/resources/protocol/modules.js:149-158, 559-560, 624-628, 666-668","cli/test/owner-ordering.test.js:50 — dormant-edge/re-enablement test independently passed.","apps/desktop/test/module-policy.test.js:37-44"]},{"id":"R4","title":"AC3: Eligibility and freshness","result":"PASS","explanation":"Compiled owner edges enter executable dependency lists, affecting eligibility and predecessor-event freshness rather than imposing stage barriers. Execution completion checks the original preparation and rejects changed predecessor events. The live regression covers Judge waiting for Code Review while Spec Evaluation remains eligible.","evidence":["plugin-src/shared/resources/protocol/modules.js:759-793","plugin-src/shared/resources/protocol/projection.js:650-723","plugin-src/shared/resources/protocol/boundary.js:118-147","plugin-src/shared/resources/protocol/execution-preparation.js:10-22","cli/test/owner-ordering.test.js:59","cli/test/agent-workflow-scheduler.test.js:137"]},{"id":"R5","title":"AC3: Isolation and migration","result":"PASS","explanation":"Ordering survives model locks, historical graph snapshots and projected dependency origins. Ordering-only migration reports changed modules and invalidated boundary gates without rewriting earlier attempts. Judge content dependencies still come exclusively from unchanged manifest dependsOn, excluding owner-added Code Review reports.","evidence":["plugin-src/shared/resources/protocol/feature.js:162-233, 300-310","plugin-src/shared/resources/protocol/projection.js:195-217, 325-343","plugin-src/shared/resources/protocol/snapshot.js:252-268, 1097-1099","plugin-src/shared/resources/protocol/agent-workflow-service.js:98-112","cli/test/owner-ordering.test.js:59","apps/desktop/test/module-policy.test.js:18-38"]},{"id":"R6","title":"AC4: Owner controls","result":"PASS","explanation":"Run after choices use discovered same-slot modules and explicitly protect hard and manifest-conditional relationships. Enablement and ordering form one staged policy. Preview refresh, including dependency absorption, carries the complete ordering draft through renderer, preload and IPC.","evidence":["apps/desktop/main/module-policy.js:175-201, 218-224","apps/desktop/renderer/renderer.js:1201-1217, 1340-1369","apps/desktop/main/ipc.js:123-143","apps/desktop/test/ordering-renderer.test.js:18","apps/desktop/test/ordering-preload.test.js:7 — real preload test independently passed."]},{"id":"R7","title":"AC4: Apply/discard safety","result":"PASS","explanation":"Ordering-only edits enable Apply and disclose the proposed relationships. Pending or superseded previews invalidate confirmation. Apply requires valid policy and explicit migration confirmation, checks the confirmed baseline, serializes publication and restores owned policy on certified migration refusal. Discard, cancellation and reload restore saved choices without applying edits.","evidence":["apps/desktop/renderer/renderer.js:1268-1317, 1325-1348, 1423-1471, 3077-3098","apps/desktop/main/module-policy.js:279-290, 315-399","plugin-src/shared/resources/protocol/feature.js:289-293, 327-340","apps/desktop/test/module-policy.test.js:47, 69, 86, 106, 282, 305","apps/desktop/test/ordering-renderer.test.js:18"]},{"id":"R8","title":"AC5: Exact DAG","result":"PASS","explanation":"The diagram renders individual combined-graph edges with retained required, conditional and owner origins. Boundary and retained finalization diagrams use attempt dependencies; policy previews use resolved edges. Skipped-layer routing and partial dependencies replace generic stage connectors. The separate stage-group inconsistency is assessed under R9.","evidence":["apps/desktop/renderer/dependency-diagram.js:6-26, 40-54","apps/desktop/renderer/renderer.js:869-872, 1010-1014, 1304-1309","apps/desktop/test/dependency-diagram.test.js:6","cli/test/owner-ordering.test.js:109, 120 — both public graph tests independently passed.",".gatereeve-agent-evidence/gates/verification/verification.md:18-19 — DOM integration and simulated browser inspection reported PASS."]},{"id":"R9","title":"AC5: Accessibility and derived grouping","result":"FAIL","explanation":"Named textual relationships, line-pattern explanations and keyboard interaction are present, but retained finalization groups are recomputed from the current model while edges and orderLabel values remain pinned to the earlier attempt. Reversing Check → Release to Release → Check therefore displays the old Check → Release DAG alongside stage 1 containing Release numbered 2 and stage 2 containing Check numbered 1. Removing the owner edge similarly collapses the current groups while retaining the older sequential numbers.","evidence":["apps/desktop/renderer/dependency-diagram.js:54-74 — accessible relationship descriptions and keyboard controls.","apps/desktop/renderer/renderer.js:901-922 — groups derive from current dependsOn, after and ownerAfter.","apps/desktop/renderer/renderer.js:958-961, 1010-1029 — retained attempt supplies diagram edges, but current inventory supplies card groups.","plugin-src/shared/resources/protocol/snapshot.js:1097-1107 — current ordering is combined with retained attempt orderLabel.","cli/test/finalization.test.js:299-321 — migration during active finalization is a supported reachable path.","Read-only in-memory probe of the pinned renderer grouping function: both model locks validated; retained edge example/check → gatereeve/release; rendered groups were stage 1 {gatereeve/release, label 2} and stage 2 {example/check, label 1}."]},{"id":"R10","title":"AC6: Portable integration and safeguards","result":"PASS","explanation":"The digest-bound formal Verification report records full CLI, Desktop, Python, template and portable package checks passing for the implementation, with a trusted nonimplementation delta to the pinned source. All 47 staged protocol files independently match their manifest hashes and canonical source. Documentation and retry handling preserve enabled requirements, isolated Judge inputs and human review authority.","evidence":[".gatereeve-agent-evidence/gates/verification/verification.md:3-21 — CLI 417, Desktop 218, Python 104+28, templates 2, package/integration checks PASS.","apps/desktop/resources/desktop-projection.json — all 47 listed files independently verified against sizes, hashes and canonical bytes.","docs/WORKFLOW-MODULES.md:106-176","plugin-src/shared/resources/protocol/boundary-retry.js:223-304","plugin-src/shared/resources/scripts/boundary_packet.py:92-132","cli/test/boundary-retry.test.js:167, 192, 208, 224"]}],"scopeCheck":{"result":"PASS","explanation":"The whole-feature review covers all ten frozen rubric IDs and the complete selected patch. The 56 changed files support policy ordering, execution freshness, Desktop controls/diagrams, portable packet integration, tests or approved documentation. No supported scope creep was identified. Publication and installed activation remain outside this boundary.","evidence":[".gatereeve-agent-evidence/inventory.json — 49 modified and 7 added files; no binary entries or renames.",".gatereeve-agent-evidence/patches/feature.json — four ordered chunks assembled to 232646 bytes and the supplied material hash.","docs/issues/tb-configurable-gate-ordering/spec.md:4","docs/issues/tb-configurable-gate-ordering/design.md"]},"gapCheck":{"result":"FAIL","explanation":"AC5/R9's consistent derived grouping is incomplete for retained finalization attempts after model adoption. The existing graph fixture and renderer tests do not establish correctness for this reachable combination of historical attempt edges and current inventory ordering.","evidence":["apps/desktop/renderer/renderer.js:1010-1029","plugin-src/shared/resources/protocol/snapshot.js:1097-1107","apps/desktop/test/dependency-diagram.test.js:6","apps/desktop/test/renderer.test.js:669-713","cli/test/finalization.test.js:299-321"]},"contradictionCheck":{"result":"FAIL","explanation":"The finalization view can simultaneously describe Check as Release's predecessor, place Release in dependency stage 1, and display Release's retained number as 2. These are contradictory explanations of the same retained attempt.","evidence":["apps/desktop/renderer/renderer.js:1012-1029","plugin-src/shared/resources/protocol/snapsho